2020-11-06T15:26:52.492-05:00,2020-11-06T15:39:22.415-05:00,2020-11-05,Sí,2020-11-06,Atlántico,,Santuario 2,En mi grupo cuento con un niño que tiene parálisis cerebral espatica y require apoyo para realizar varias actividades con ayuda de la mama hemos realizado varias experiencias para afianzar su cordinacion y equilibrio en una ocasión  la actividad era que el niño intentara caminar sobre una linea recta al principio el corria pero despues de varios intento logro realizar la actividad,#cordinacion.equilibrio,Motivación,De vez en cuando,La apropiación y uso de herramientas tecnológicas. La vinculación de las familias a las propuestas del Centro de Desarrollo Infantil.,1,0,1,0,0,0,0,0,0,0,0,Niños/niñas,,Fui muy honesto y conté lo que me pasó,"Habilidades comunicativas: contar historias, argumentar, conversar, exponer ideas, escribir textos, leer y comprender.",0,1,0,0,0,0,Trabajo Colaborativo. Manejo de herramientas tecnológicas. Manejo de la Información y Comunicación.,1,0,0,0,1,1,0,0,Acompañar a las familias para que apoyen el desarrollo de sus hijos.,135526196,85aaab7d-4d75-4247-ae61-47d15c5b8974,2020-11-06T20:39:35,,83
2020-11-06T15:05:18.485-05:00,2020-11-06T15:08:39.897-05:00,2020-11-05,Sí,2020-11-06,Atlántico,,CDI Niño Jesus Olaya,Es muy satisfactorio ver a los niños tan motivados con las experiencias pedagógicas y hay un caso en especial de una beneficiaria a la que le encanta crear historias y leerlas para mí a partir de lo que ve en imágenes,#Amarleyendo,Motivación,De vez en cuando,El acompañamiento a las transiciones de las niñas y los niños.,0,0,0,0,0,0,0,1,0,0,0,Niños/niñas,,Fui muy honesto y conté lo que me pasó,"Habilidades comunicativas: contar historias, argumentar, conversar, exponer ideas, escribir textos, leer y comprender.",0,1,0,0,0,0,Manejo de la Información y Comunicación. Creatividad e Innovación.,0,0,0,0,0,1,1,0,Potenciar el desarrollo de los niños y las niñas.,135523283,d2e18a20-5733-4e8d-9316-c1a062bccf0f,2020-11-06T20:08:52,,84
2020-11-05T17:26:04.315-05:00,2020-11-05T17:38:51.688-05:00,2020-11-04,Sí,2020-11-05,Atlántico,,Cdi niño jesus olaya,"Una de las mas grandes experiencias que me ha dejado este periodo de pandemia con los niños y niñas del ambiente 8 que es el que tengo asignado es las muestras de amor y cariño de parte de los niños y niñas al momento de las llamadas ,de los diferentes encuentros por zoom , donde cada uno participa  me cuentan las experiencias  que viven en casa y como les gustas desarrollar cada una de ellas despues de ver los videos vivenciales que les envio cada semana se ejemplo para fortalecer su aprendizaje y gozar de ellos a pesar de no haberlos podido conocer brindarles todo mi amor y los conocimientos que me ayuden a potencializar sus habilidades.",#pasionporloquehagoamoeducar,Motivación,Todo el tiempo,La apropiación y uso de herramientas tecnológicas. La vinculación de las familias a las propuestas del Centro de Desarrollo Infantil. La calidad de las interacciones entre los actores.,1,0,1,0,0,0,1,0,0,0,0,Niños/niñas,,Fui muy honesto y conté lo que me pasó,"Habilidades artísticas: bailar, cantar, actuar/representar, dibujar/pintar, tocar instrumentos, modelar, jugar. Habilidades comunicativas: contar historias, argumentar, conversar, exponer ideas, escribir textos, leer y comprender. Habilidades socioemocionales:  meditar, acompañar y guiar, sentido del humor, incentivar y motivar, compartir y ser solidario, auto-regulación.",1,1,1,0,0,0,Trabajo Colaborativo. Pensamiento Crítico. Resolución de problemas. Manejo de herramientas tecnológicas. Creatividad e Innovación.,1,0,1,1,1,0,1,0,Potenciar el desarrollo de los niños y las niñas.,135523496,8c0b8dc6-4a18-4447-a386-7aae63ecaa1a,2020-11-06T20:11:12,,85
2020-11-06T15:05:27.458-05:00,2020-11-06T15:13:41.748-05:00,2020-11-05,Sí,2020-11-05,Atlántico,,Cdi niño jesus olaya,La experiencia mas significativa en este tiempo de pandemia ha sido la satisfaccion de poder enseñar y educar con todos los retos vividos en especial con el amor y cariño que cada uno de mis niños y niñas me muestran a traves de las llamadas y encuentros via zoom el poder laprender  de ellos no tiene precio sus  muestras de amor y el recocerme sin habernos vistos solo con mi voz no tiene precio una pantalla marca el cambio de una nueva historia de aprendizajes significativos.,#pasionporloquehagoamoeducar,Motivación,Todo el tiempo,La apropiación y uso de herramientas tecnológicas. La vinculación de las familias a las propuestas del Centro de Desarrollo Infantil. La disposición intencionada de los espacios y ambientes. El acompañamiento a las transiciones de las niñas y los niños.,1,0,1,0,0,1,0,1,0,0,0,Niños/niñas,,Fui muy honesto y conté lo que me pasó,"Habilidades artísticas: bailar, cantar, actuar/representar, dibujar/pintar, tocar instrumentos, modelar, jugar. Habilidades comunicativas: contar historias, argumentar, conversar, exponer ideas, escribir textos, leer y comprender. Habilidades socioemocionales:  meditar, acompañar y guiar, sentido del humor, incentivar y motivar, compartir y ser solidario, auto-regulación.",1,1,1,0,0,0,Trabajo Colaborativo. Pensamiento Crítico. Manejo de herramientas tecnológicas. Manejo de la Información y Comunicación. Creatividad e Innovación.,1,0,1,0,1,1,1,0,Potenciar el desarrollo de los niños y las niñas.,135523868,6a599d2a-b2bd-4a5e-add1-398bca00e661,2020-11-06T20:14:36,,86
2020-11-06T15:11:41.279-05:00,2020-11-06T15:16:40.985-05:00,2020-11-05,Sí,2020-11-06,Atlántico,,Cdi niño Jesús Olaya,"Al entrar al cdi conocí a una niña con una situación familiar bastante difícil, al compartir con ella dia a dia y afianzar sus procesos de aprendizaje comprendí lo inteligente que era y le tome mucho cariño, realmente me marcó como maestra",#amordemaestraquemuchasvecesseconvierteenmama,Motivación,De vez en cuando,El acompañamiento a las transiciones de las niñas y los niños.,0,0,0,0,0,0,0,1,0,0,0,Niños/niñas,,Fui muy honesto y conté lo que me pasó,"Habilidades artísticas: bailar, cantar, actuar/representar, dibujar/pintar, tocar instrumentos, modelar, jugar.",1,0,0,0,0,0,Creatividad e Innovación.,0,0,0,0,0,0,1,0,Potenciar el desarrollo de los niños y las niñas.,135524010,ab6eba6a-3f1b-48dd-b8d5-210bc4ab2f8e,2020-11-06T20:16:44,,87
2020-11-06T15:07:54.881-05:00,2020-11-06T15:19:29.145-05:00,2020-11-05,Sí,2020-11-06,Atlántico,,Niño  Jesús olaya,Una de las situaciones más significativas que experimente  como agente educativo es haber logrado fortalecer los lazos afectivos con mis niños y sus familias a pesar de la distancia y sobre todo su apoyo y colaboración en todo el proceso,#unidoslogramosmas,Alegría,Todo el tiempo,La vinculación de las familias a las propuestas del Centro de Desarrollo Infantil.,0,0,1,0,0,0,0,0,0,0,0,Niños/niñas,,Fui muy honesto y conté lo que me pasó,"Habilidades comunicativas: contar historias, argumentar, conversar, exponer ideas, escribir textos, leer y comprender.",0,1,0,0,0,0,Trabajo Colaborativo. Creatividad e Innovación.,1,0,0,0,0,0,1,0,Acompañar a las familias para que apoyen el desarrollo de sus hijos.,135524328,08e1c275-f143-4caa-a4dd-514315781c91,2020-11-06T20:19:41,,88
2020-11-06T15:13:42.029-05:00,2020-11-06T15:22:27.620-05:00,2020-11-05,Sí,2020-11-06,Atlántico,,Fundacion fusion celestial,Al realizar la actividad el baul de la independencia el niño Hian Salas Suarez le expresaba a su mamita atraves de plasmar o dibujar dos corazones colocandose a ella y otro a el dijo madre te quiero mucho y tus abrazos y besos por las noches me llenan mucho de emocion,Expreso mis sentimientos,Alegría,Todo el tiempo,El desempeño de los docentes y sus prácticas.,0,0,0,0,1,0,0,0,0,0,0,Familias y otras personas significativas,,Fui muy honesto y conté lo que me pasó,"Habilidades comunicativas: contar historias, argumentar, conversar, exponer ideas, escribir textos, leer y comprender.",0,1,0,0,0,0,Trabajo Colaborativo.,1,0,0,0,0,0,0,0,Acompañar a las familias para que apoyen el desarrollo de sus hijos.,135524815,cbd3fe91-4d76-418e-9106-11e28a52352b,2020-11-06T20:22:40,,89
2020-11-06T15:16:52.038-05:00,2020-11-06T15:23:42.331-05:00,2020-11-05,Sí,2020-11-06,Atlántico,,CDI niño Jesús olaya,Debido a la contingencia tocó realizar el proceso de acompañamiento por llamadas lo cual significo un reto para mí y aún estoy en busca de la aceptación total de los padres hacia esta manera de transmitirle conocimiento a mis niños y niñas.,#retoacompañamiemto.,Orgullo,De vez en cuando,La apropiación y uso de herramientas tecnológicas.,1,0,0,0,0,0,0,0,0,0,0,Familias y otras personas significativas,,Fui muy honesto y conté lo que me pasó,"Habilidades socioemocionales:  meditar, acompañar y guiar, sentido del humor, incentivar y motivar, compartir y ser solidario, auto-regulación.",0,0,1,0,0,0,Manejo de la Información y Comunicación.,0,0,0,0,0,1,0,0,Acompañar a las familias para que apoyen el desarrollo de sus hijos.,135524965,999f7574-c802-43d9-9001-556884487695,2020-11-06T20:23:54,,90
2020-11-06T15:19:29.234-05:00,2020-11-06T15:26:21.236-05:00,2020-11-05,Sí,2020-11-06,Atlántico,,CDI niño Jesús,"Mi historia inicia en el CDI niño Jesús olaya en donde conocí un grupo de niños maravillosos y sus familias  quienes me escogieron  y brindaron todo su apoyó  en cada una de las experiencias propuestas para mis niños , lo cual me mostraba como nuestros lazos se fortalecía,  cada vez que realizaba contacto telefónico con mis niños lograba sentir su  emoción al escucharme  lo cuál  me hace muy feliz",#unidospodemosmas,Alegría,Todo el tiempo,La vinculación de las familias a las propuestas del Centro de Desarrollo Infantil.,0,0,1,0,0,0,0,0,0,0,0,Niños/niñas,,Fui muy honesto y conté lo que me pasó,"Habilidades comunicativas: contar historias, argumentar, conversar, exponer ideas, escribir textos, leer y comprender.",0,1,0,0,0,0,Trabajo Colaborativo.,1,0,0,0,0,0,0,0,Acompañar a las familias para que apoyen el desarrollo de sus hijos.,135525197,2e3dd9e5-498d-48ee-9b78-22e4ac2df2d6,2020-11-06T20:26:33,,91
2020-11-06T15:27:05.744-05:00,2020-11-06T15:35:51.384-05:00,2020-11-05,Sí,2020-11-06,Atlántico,,Fundacion fusion celestial,Al desarrollar la actividad  hallemos el tesoro las familias se divertieron  al esconder y poder jugar a lad escondidas expresaron sus emociones y pensamientos para encontrar su  tesoro escondido,Buscando un tesoro,Motivación,Todo el tiempo,La disposición intencionada de los espacios y ambientes.,0,0,0,0,0,1,0,0,0,0,0,Niños/niñas,,Reflexioné y aprendí algo nuevo,"Habilidades comunicativas: contar historias, argumentar, conversar, exponer ideas, escribir textos, leer y comprender.",0,1,0,0,0,0,Trabajo Colaborativo.,1,0,0,0,0,0,0,0,Acompañar a las familias para que apoyen el desarrollo de sus hijos.,135525914,6992015b-050e-466a-ae50-1dbd7fa86956,2020-11-06T20:36:04,,92
2020-11-06T15:34:45.067-05:00,2020-11-06T15:38:02.199-05:00,2020-11-05,Sí,2020-11-06,Atlántico,,CDI niño Jesús olaya,"Tuve una niña con mucho conflicto y nunca se le había celebrado un cumpleaños, era una niña muy violenta y se le celebró su cumpleaños en el cdi y la niña fue muy feliz y cambió su comportamiento",#podemos cambiar,Motivación,Única vez,La vinculación de las familias a las propuestas del Centro de Desarrollo Infantil.,0,0,1,0,0,0,0,0,0,0,0,Niños/niñas,,Fui muy honesto y conté lo que me pasó,"Habilidades artísticas: bailar, cantar, actuar/representar, dibujar/pintar, tocar instrumentos, modelar, jugar.",1,0,0,0,0,0,Resolución de problemas.,0,0,0,1,0,0,0,0,"Fortalecerme como agente educativo para alcanzar mis proyectos personales, familiares y profesionales.",135526116,74041c82-e02f-4d3c-90f6-8e28b2ae65fc,2020-11-06T20:38:13,,93
2020-11-06T15:25:09.265-05:00,2020-11-06T15:44:21.708-05:00,2020-11-05,Sí,2020-11-06,Atlántico,,Santuario 2,Esta situación me ocurrió precisamente la semana pasada que pedí a las padres y/o acompañantes realizar un Álbum de etiquetas de productos de fac.acceso al entorno hogar. Una experiencia para desarrollar la conciencia fonológica e incentivar la lectura relacionandola con las imagenes para sorpresa y disgusto mío (al mismo tiempo) por qué al  explicarle a los padres la experiencia se reían y me decían que ellos acaso sabían leer.  Me sentí mal pues no percibí apoyo para lograr con éxito hubo muchas excusas  para no realizarla. Pero dos mamitas de esas que siempre están dispuestas a atender y realizar las experiencias con alegría compartieron sus videos y los demás se motivaron y lo realizaron y que alegría y satisfacción al ver a mis niños enseñando su álbum y demostrando ellos solitos a sus papitos que si se puede y que el apoyo de casa es indispensable para alcanzar metas.,#etiquetasexitosas,Motivación,De vez en cuando,Las formas como están organizadas las rutinas diarias. La vinculación de las familias a las propuestas del Centro de Desarrollo Infantil. El acompañamiento a las transiciones de las niñas y los niños.,0,1,1,0,0,0,0,1,0,0,0,Niños/niñas,,Fui muy honesto y conté lo que me pasó,"Habilidades artísticas: bailar, cantar, actuar/representar, dibujar/pintar, tocar instrumentos, modelar, jugar. Habilidades socioemocionales:  meditar, acompañar y guiar, sentido del humor, incentivar y motivar, compartir y ser solidario, auto-regulación.",1,0,1,0,0,0,Trabajo Colaborativo. Resolución de problemas. Creatividad e Innovación.,1,0,0,1,0,0,1,0,Acompañar a las familias para que apoyen el desarrollo de sus hijos.,135526660,1b0fa47a-503c-4db5-a6db-2238b0a964d5,2020-11-06T20:44:35,,94
2020-11-06T15:06:05.201-05:00,2020-11-06T15:46:50.320-05:00,2020-11-05,Sí,2020-11-06,Atlántico,,CDI  Gimnasio San luis,Bueno en primer lugar una experie ncia es la ver la creatividad de los padres realizando cada experiencia con sus hijos en el aspecto de crear ambientes y transformando el hogar en un aula disfrazando o creando con objetos encontrados en su entorno para buscar mejores aprendizajes con los niños y niñas  adquiriendo de parte de las maestras los conocimientos para poder transmitir los a sus hijos un trabajo en equipo que ha sido muy satisfactorio en este tiempo de pandemia,#trabajando en equipo,Motivación,Todo el tiempo,El trabajo colaborativo entre las y los Agentes Educativos.,0,0,0,0,0,0,0,0,0,1,0,Familias y otras personas significativas,,Fui muy honesto y conté lo que me pasó,"Habilidades socioemocionales:  meditar, acompañar y guiar, sentido del humor, incentivar y motivar, compartir y ser solidario, auto-regulación.",0,0,1,0,0,0,Trabajo Colaborativo.,1,0,0,0,0,0,0,0,Acompañar a las familias para que apoyen el desarrollo de sus hijos.,135526975,869b3780-bb3f-45b3-a799-04103ff252de,2020-11-06T20:47:02,,95
2020-11-06T15:32:42.098-05:00,2020-11-06T15:58:30.117-05:00,2020-11-05,Sí,2020-11-06,Atlántico,,CDI LA PLAYA ADR amira de la rosa,"durante este año 2020, he podido ser testigo de los fortalecimientos  que se han generado en las familias gracias a que las actividades desde transito armonioso y las de educacion inicial en el programa de primera infancia, donde los padres y beneficiarios han mostrado su gran creatividad y responsabilidad en el cumplimiento de estas, ya que han entendido la importancia de ser participes en el proceso de transito armonioso de cada año culminado y el cambio que los niños y niñas de educacion inicial tienen ar realizar el nuevo año de transicion, ayudan al proceso de actividades tales como dar a conocer el uso del maletin, el agarre de la pinza tripode, el reconocimiento de colores, figuras geometricas, nociones como arriba-abajo,dentro-fuera en fin todo lo que compete en el desarrollo y conocimiento de transito armonioso para que los infantes puedan adquirir la base del nuevo año en transicion, ver como cada niño cada niña da de si mismo para poder avanzar en los procesos desde transito armonioso, escucharlos hablar que el otro año van para un colegio donde todo sera diferente porque el hacerles saber que sera una nueva etapa en sus vidas, donde seran mas independientes y responsables, donde no habra una maestra que les de la comida, que ellos deberan alimentarse solos y ser responsables de comer porque eso les generara una buena salud, donde la maestra ya no lavara sus manos ni sus dientes, que ellos lo haran en sus casitas y que eso forma parte de sus obligaciones personales, que ahora tendran cuadernos y deben ser responsables de ellos, cuidandolos y manteniendolos en orden y limpios, es un proceso hermoso porque es la etapa donde el niño y la niña da a conocer sus buenos habitos y principios que se aprenden en la educacion inicial, mas que un aprendizaje academico es un aprendizaje integral, por eso somos llamados centro de desarrollo infantil, somos responsables del desarrollo integral de los niños y niñas en primera infancia, es hermoso ver como cada etapa de nuestros niños en el programa se van cumpliendo de acuerdo a sus edades, ver que en los 4 a  años ellos asumen la responsabilidad a nivel personal para asi poder iniciar una nueva etapa en la educacion: transito armonioso, me siento feliz y doy gracias a Dios por ser parte de la educacion inicial en la primera y mejor etapa de todo ser humano, su infancia, verlos crecer e ir logrando todos esos indicadores de logros segun sus edades, primera infancia es lo mejor en educacion inicial, un placer de estar participando en este gran proyecto... la gran transicion , mucho gusto coordinadora maria teresa cadena del CDI la playa ADR.",primera infancia lo mejor en educacion inicial,Motivación,Todo el tiempo,El acompañamiento a las transiciones de las niñas y los niños.,0,0,0,0,0,0,0,1,0,0,0,Niños/niñas,,Fui muy honesto y conté lo que me pasó,"Habilidades socioemocionales:  meditar, acompañar y guiar, sentido del humor, incentivar y motivar, compartir y ser solidario, auto-regulación.",0,0,1,0,0,0,Trabajo Colaborativo. Resolución de problemas. Creatividad e Innovación. Vida y Carrera.,1,0,0,1,0,0,1,1,Acompañar a las familias para que apoyen el desarrollo de sus hijos.,135527902,b5e43c67-4d82-4102-834d-1dab904a2c75,2020-11-06T20:58:41,,96
2020-11-06T15:48:13.459-05:00,2020-11-06T15:58:38.603-05:00,2020-11-05,Sí,2020-11-06,Atlántico,,CDI 2,Al realizar la actividad con las familias descubramos el tesoro los niños y niñas al explorar el medio de su entorno familiar al lograr pasar los obstaculos para descubrir el gran tesoro con gran emocion y divertidad  jugaban al mismo tiempo al escondida utilizaron como herramienta la lupa para observar mejor y  encontrsrlo de primero todos los integrantes se emocionaron,Hayemos el tesoro,Motivación,Todo el tiempo,La disposición intencionada de los espacios y ambientes.,0,0,0,0,0,1,0,0,0,0,0,Niños/niñas,,Fui muy honesto y conté lo que me pasó,"Habilidades comunicativas: contar historias, argumentar, conversar, exponer ideas, escribir textos, leer y comprender.",0,1,0,0,0,0,Creatividad e Innovación.,0,0,0,0,0,0,1,0,Acompañar a las familias para que apoyen el desarrollo de sus hijos.,135527911,c3165b17-c25b-4e03-b647-9d0bc41054f2,2020-11-06T20:58:50,,97
2020-11-06T16:17:23.764-05:00,2020-11-06T16:34:42.011-05:00,2020-11-05,Sí,2020-11-06,Atlántico,,GIMNASIO SAN LUIS,"MI NOMBRE ES ERASMINA BARRAZA HACE 10 MESES ME CONSIDERABA UNA PERSONA ESTABLE TANTO ECONOMICA Y EMOCIONAL DEBIDO A QUE NO PRESENTABA NINGUNA PREOCUPACION EN CUNTO A EL ENTORNO , PERO DADO EL TIEMPO EN EL QUE SE E PRESENTO LA GRISIS POR CAUSA DE LO QUE HOY CONOCEMOS POR COVID-19 MI VIDA TANTO COMO LA DE MI FAMILIA Y ESTUDIANTES A LOS CUALES EJERSO MIS SERVICIOS HAN PASADO POR UNA GRISIS TANTO ECONOMICA COMO EMOCIONAL ,  DICHA SITUACION A TRAIDO COSAS POSITIVAS Y NEGATIVAS DONDE SE RESALTA MAS LOS ASPECTOS POSITIVOS, YA QUE EL AISLAMIENTO HA  HECHO QUE LAS FAMILIAN ESTEN MAS UNIDOS Y LOS NIÑOS SE SIENTAN MAS PROTEGIDOS,  DONDE LES HE PODIDO BRINDAR MIS CONOCIMIENTOS DE MANERA VIRTUAL Y HEMOS PODIDO FORTALECER LOS VINCULOS Y DIVERTIRNOS.",#EMOCIONES NUEVAS,Motivación,Única vez,El desempeño de los docentes y sus prácticas. La calidad de las interacciones entre los actores. El trabajo colaborativo entre las y los Agentes Educativos.,0,0,0,0,1,0,1,0,0,1,0,Familias y otras personas significativas,NIÑOS Y AGENTES EDUCATIVOS,Reflexioné y aprendí algo nuevo,"Habilidades socioemocionales:  meditar, acompañar y guiar, sentido del humor, incentivar y motivar, compartir y ser solidario, auto-regulación.",0,0,1,0,0,0,Trabajo Colaborativo. Resolución de problemas. Manejo de la Información y Comunicación. Creatividad e Innovación.,1,0,0,1,0,1,1,0,Acompañar a las familias para que apoyen el desarrollo de sus hijos.,135531362,af3ee4eb-7ca1-4b6a-8df3-1b4cea67e3a0,2020-11-06T21:34:52,,98
2020-11-06T16:49:29.232-05:00,2020-11-06T16:58:25.271-05:00,2020-11-05,Sí,2020-11-06,Atlántico,,Niño Jesús Olaya,"La experiencia que estoy viviendo en el cdi en este año ha tenido 2 contrastes uno malo debido a la pandemia y que ahi muchas personas que han perdido su vida debido a esto. Tambien es muy triste el no poder compartir con los niños directamente en el cdi enseñarles, atenderlos, verlos crecer y darles mucho amor. Lo bueno ha sido que hemos aprendido e innovado que por medio de la parte digital y poder aceecarnos a nuestros niños y niñas",# Innovando,Motivación,Todo el tiempo,La apropiación y uso de herramientas tecnológicas.,1,0,0,0,0,0,0,0,0,0,0,Niños/niñas,,Fui muy honesto y conté lo que me pasó,"Habilidades socioemocionales:  meditar, acompañar y guiar, sentido del humor, incentivar y motivar, compartir y ser solidario, auto-regulación.",0,0,1,0,0,0,Manejo de herramientas tecnológicas. Manejo de la Información y Comunicación. Creatividad e Innovación.,0,0,0,0,1,1,1,0,Potenciar el desarrollo de los niños y las niñas.,135533563,aa90dfdf-b80f-45dc-8273-d8399ae99f37,2020-11-06T21:58:37,,99
2020-11-07T11:19:28.123-05:00,2020-11-07T11:36:10.423-05:00,2020-11-06,Sí,2020-11-07,Atlántico,,CDI Niño Jesús  Galán,Una de las formas en las cuales le hemos sacado provecho en torno a lo que ha sucedido alrededor de la emergencia sanitaria es con el uso de las herramientas tecnológicas hemos llegado a impactar la vida de las familias y a contribuir al desarrollo de los niños y niñas por medio de los medios audio-visuales ya sea porque son un medio de entretención y de aprendizaje para los niños y niñas como también tenemos la oportunidad de ofrecer una educación mucho más personalizada.,La satisfacción de los medios de comunicación.,Orgullo,De vez en cuando,La apropiación y uso de herramientas tecnológicas.,1,0,0,0,0,0,0,0,0,0,0,Familias y otras personas significativas,,Reflexioné y aprendí algo nuevo,"Habilidades socioemocionales:  meditar, acompañar y guiar, sentido del humor, incentivar y motivar, compartir y ser solidario, auto-regulación.",0,0,1,0,0,0,Manejo de herramientas tecnológicas.,0,0,0,0,1,0,0,0,Solucionar la situación poniendo en práctica mis conocimientos profesionales y personales.,135694867,19557566-65a1-4cc1-9702-a1bb95230d3c,2020-11-07T16:36:22,,100
2020-11-07T11:36:10.498-05:00,2020-11-07T11:49:32.320-05:00,2020-11-06,Sí,2020-11-07,Atlántico,,CDI Niño Jesús Galán,"Una de los mayores desafíos que tenían las agentes educativas en el comienzo de la emergencia sanitaria, radicaba en el hecho de inculcar a los cuidadores de los niños y niñas la importancia de las rutinas diarias en casa, en donde a los niños se les designará y se respetaran los tiempos de sus experiencias pedagógicos, tiempo para jugar, tiempo para descansar y tiempo para velar por su cuidado (aseo, alimentación) estas rutinas lograron ser interiorizadas por las familias en la medida en que las convertían en un hábito ya que desde casa quienes se convertían en los maestros de sus niños y niñas, eran sus propios padres, esta experiencia funcionó para que los padres adquirieran el sentido del orden y responsabilidad, no sólo con su casa, su trabajo, sino también con la educación de sus hijos e hijas.",Rutinas y Educación en Casa,Tranquilidad,Todo el tiempo,Las formas como están organizadas las rutinas diarias.,0,1,0,0,0,0,0,0,0,0,0,Niños/niñas,,Fui muy honesto y conté lo que me pasó,"Habilidades comunicativas: contar historias, argumentar, conversar, exponer ideas, escribir textos, leer y comprender.",0,1,0,0,0,0,Trabajo Colaborativo. Manejo de la Información y Comunicación. Vida y Carrera.,1,0,0,0,0,1,0,1,Acompañar a las familias para que apoyen el desarrollo de sus hijos.,135697172,f826682b-40c8-4218-99b4-6c22a8264e97,2020-11-07T16:49:44,,101
2020-11-07T15:10:10.840-05:00,2020-11-07T15:22:17.738-05:00,2020-11-06,Sí,2020-11-07,Atlántico,,Cepeda samudio,"Este año  ha sido un año diferente sin embargo puedo contar que  tengo un grupo de niños  y niñas  hermosos que todos los dias me regalan un sonrisa a traves de videos y audios , me cuenta sus historias vividas en su hogar en este tiempo de pandemia,  los niños y sus padres  son colaboradores alegres y siempre tienen una palabra amable para recibir el llamado de su maestra",La maestra y sus niños( a) hermosos,Alegría,Todo el tiempo,El acompañamiento a las transiciones de las niñas y los niños.,0,0,0,0,0,0,0,1,0,0,0,Niños/niñas,,Fui muy honesto y conté lo que me pasó,"Habilidades socioemocionales:  meditar, acompañar y guiar, sentido del humor, incentivar y motivar, compartir y ser solidario, auto-regulación.",0,0,1,0,0,0,Manejo de la Información y Comunicación.,0,0,0,0,0,1,0,0,Acompañar a las familias para que apoyen el desarrollo de sus hijos.,135725135,be1702fa-a019-4382-8df8-f91db6ab79c6,2020-11-07T20:22:29,,102
