2020-11-04T09:01:17.140-05:00,2020-11-04T09:20:05.782-05:00,2020-11-03,Sí,2020-11-04,Atlántico,,CDI la playa ADR,Las familias en los procesos desde tránsito armonioso,Transito armonioso 2020,Motivación,Todo el tiempo,La documentación de las experiencias realizadas en el Centro de Desarrollo Infantil.,0,0,0,0,0,0,0,0,1,0,0,Niños/niñas,,Fui muy honesto y conté lo que me pasó,"Habilidades socioemocionales:  meditar, acompañar y guiar, sentido del humor, incentivar y motivar, compartir y ser solidario, auto-regulación.",0,0,1,0,0,0,Trabajo Colaborativo. Resolución de problemas. Manejo de la Información y Comunicación.,1,0,0,1,0,1,0,0,Acompañar a las familias para que apoyen el desarrollo de sus hijos.,134959166,c0c642bd-5579-46c3-827e-3be66356a66c,2020-11-04T14:20:18,,38
2020-11-04T09:03:29.085-06:00,2020-11-04T09:21:13.778-06:00,2020-11-03,Sí,2020-11-04,Atlántico,,CDI La playa ADR,"Cuando comenzamos con esta pandemia el niño no le gustaba hacer ninguna actividad ni tomar evidencias y ahora  la madre me comenta que estoy todo el dia con el niño, ya que la madre le dice la seño ando a hacer las actividades y el ya no molesta ni para comer , ya que hasta la seño le manda las comidas y el no molesta para nada , es muy bonito vivir esas experiencias .",EMMANUEL FELIZ CON SU MAESTRA,Alegría,Todo el tiempo,La vinculación de las familias a las propuestas del Centro de Desarrollo Infantil.,0,0,1,0,0,0,0,0,0,0,0,Niños/niñas,,Fui muy honesto y conté lo que me pasó,"Habilidades comunicativas: contar historias, argumentar, conversar, exponer ideas, escribir textos, leer y comprender.",0,1,0,0,0,0,Trabajo Colaborativo.,1,0,0,0,0,0,0,0,Acompañar a las familias para que apoyen el desarrollo de sus hijos.,134959863,0cfe64ff-cd18-4e6a-9761-2478fc4221ff,2020-11-04T14:21:47,,39
2020-11-04T09:05:31.932-05:00,2020-11-04T09:09:28.273-05:00,2020-11-03,Sí,2020-11-04,Atlántico,,Cdi la playa,Realizar una narración del renacuajo paseador donde vi el entusiasmo de ellos al ver mis videos fua mi motivación para seguir fortalecimiento la lectura,#animación a lectura,Motivación,De vez en cuando,El acompañamiento a las transiciones de las niñas y los niños.,0,0,0,0,0,0,0,1,0,0,0,Niños/niñas,,Fui muy honesto y conté lo que me pasó,"Habilidades comunicativas: contar historias, argumentar, conversar, exponer ideas, escribir textos, leer y comprender.",0,1,0,0,0,0,Creatividad e Innovación.,0,0,0,0,0,0,1,0,Potenciar el desarrollo de los niños y las niñas.,134960378,6bc050e0-2c2e-40b7-9b97-965ff98b6871,2020-11-04T14:23:16,,40
2020-11-04T08:49:54.684-05:00,2020-11-04T09:23:35.175-05:00,2020-11-03,Sí,2020-11-04,Atlántico,,CDI AMIRA DE LA ROSA ADR,"Cuando yo comencé fue como auxiliar, luego el cdi me dio la de ser maestra titular, me llamo la atencion un niño que no caminaba teniendo la edad para hacerlo, se comenzo a tratar con la psicologa con ejercicios y se ayudo a la mamá porque ella no aceptaba que su niño tenia un problema, para non alargar la historia al final de año como en noviembre estabamos en el ambiente el niño de repente se levanto y salio caminando fue muy emocionante hasta llore lo grave con mi celular",# Mi amor chiquito,Alegría,De vez en cuando,El trabajo colaborativo entre las y los Agentes Educativos.,0,0,0,0,0,0,0,0,0,1,0,Niños/niñas,,Fui muy honesto y conté lo que me pasó,"Habilidades artísticas: bailar, cantar, actuar/representar, dibujar/pintar, tocar instrumentos, modelar, jugar.",1,0,0,0,0,0,Trabajo Colaborativo. Sostenibilidad. Manejo de la Información y Comunicación.,1,1,0,0,0,1,0,0,Acompañar a las familias para que apoyen el desarrollo de sus hijos.,134960548,241d0334-f9bf-439b-8f9f-5bf3d3723e09,2020-11-04T14:23:45,,41
2020-11-04T08:58:37.506-05:00,2020-11-04T09:25:30.450-05:00,2020-11-03,Sí,2020-11-04,Atlántico,,CDI LUZ 2 ADR,"El año pasado cuando ingresé a trabajar en el CDI LUZ 2 ADR me tocó un ambiente algo pesado donde me tocó enseñarle modales, entre otras cosas, le enseñé a realizar experimentos, números vocales, llevándolo un tránsito armonioso como pasando desde el juego a saber comportarnos a realizar las experiencias y a explorar.",Todo de un extremo a otro,Orgullo,Todo el tiempo,La vinculación de las familias a las propuestas del Centro de Desarrollo Infantil. El acompañamiento a las transiciones de las niñas y los niños. La documentación de las experiencias realizadas en el Centro de Desarrollo Infantil.,0,0,1,0,0,0,0,1,1,0,0,Otro,"Niños, niñas, familia y CDI",Fui muy honesto y conté lo que me pasó,"Habilidades artísticas: bailar, cantar, actuar/representar, dibujar/pintar, tocar instrumentos, modelar, jugar. Habilidades comunicativas: contar historias, argumentar, conversar, exponer ideas, escribir textos, leer y comprender. Habilidades socioemocionales:  meditar, acompañar y guiar, sentido del humor, incentivar y motivar, compartir y ser solidario, auto-regulación. Habilidades manuales: tejer, sembrar, cocinar. Habilidades socio-ambientales: cuidado de sí mismo, de otros y de la naturaleza.",1,1,1,1,1,0,Trabajo Colaborativo. Pensamiento Crítico. Creatividad e Innovación.,1,0,1,0,0,0,1,0,Potenciar el desarrollo de los niños y las niñas.,134961114,38754ebe-416c-42bd-a2ba-9e9c5add8afc,2020-11-04T14:25:43,,42
2020-11-04T09:22:44.275-05:00,2020-11-04T09:28:20.253-05:00,2020-11-03,Sí,2020-11-04,Atlántico,,Cdi la playa,"Bueno en mi primer año como maestra llegué a un grupo que tenía inconvenientes con la disciplina no acataba órdenes, tenían mal comportamiento y de verdad me cuestionaba como maestra como será que lo estoy haciendo mal, pero no me di por vencida y busque estrategias pedagógicas y ver su cambió fue muy gratificante para mi y me dio mas motivación para seguir continuando como maestra, a pesar de los obstáculos que encontremos dentro de ambiente pedagógico",#no darse porvencida,Motivación,Única vez,El trabajo colaborativo entre las y los Agentes Educativos.,0,0,0,0,0,0,0,0,0,1,0,Niños/niñas,,Fui muy honesto y conté lo que me pasó,"Habilidades artísticas: bailar, cantar, actuar/representar, dibujar/pintar, tocar instrumentos, modelar, jugar.",1,0,0,0,0,0,Creatividad e Innovación.,0,0,0,0,0,0,1,0,Potenciar el desarrollo de los niños y las niñas.,134962021,521e8938-fe3a-4e3c-b7e8-229293204238,2020-11-04T14:28:32,,43
2020-11-04T09:27:19.473-05:00,2020-11-04T09:35:49.406-05:00,2020-11-03,Sí,2020-11-04,Atlántico,,CDI AMIRA DE LA ROSA,"Acompaño las transiciones de los niños y las niñas hablando del Colegio grande, les cuento todo lo que van a descubirir, que van a tener otros espacios,",Cuenta cuentos,Motivación,Única vez,El acompañamiento a las transiciones de las niñas y los niños.,0,0,0,0,0,0,0,1,0,0,0,Niños/niñas,,Reflexioné y aprendí algo nuevo,"Habilidades comunicativas: contar historias, argumentar, conversar, exponer ideas, escribir textos, leer y comprender.",0,1,0,0,0,0,Manejo de la Información y Comunicación.,0,0,0,0,0,1,0,0,Potenciar el desarrollo de los niños y las niñas.,134964286,9a800907-3837-453f-abc2-6eb9948d2097,2020-11-04T14:36:00,,44
2020-11-04T09:35:33.293-05:00,2020-11-04T09:44:23.769-05:00,2020-11-03,Sí,2020-11-04,Antioquia,,CDI AMIRA DE LA ROSA ADR,El año pasado fue muy gratificante para mi porque pude lograr que un niño bastante dificil  lograra adquirir conocimientos significativos los cuales que vieron reflejados al momento de presentar su examen de admision enun colegio publico y obtener excelentes resultados. Tanto el como su mamá estaban felices.,Todos podemos,Alegría,Todo el tiempo,El acompañamiento a las transiciones de las niñas y los niños.,0,0,0,0,0,0,0,1,0,0,0,Niños/niñas,,Fui muy honesto y conté lo que me pasó,"Habilidades socioemocionales:  meditar, acompañar y guiar, sentido del humor, incentivar y motivar, compartir y ser solidario, auto-regulación.",0,0,1,0,0,0,Trabajo Colaborativo.,1,0,0,0,0,0,0,0,Potenciar el desarrollo de los niños y las niñas.,134966871,8ecaae2f-4253-4360-9fe8-fe5196bc6aee,2020-11-04T14:44:26,,45
2020-11-04T09:33:44.574-05:00,2020-11-04T09:46:07.427-05:00,2020-11-03,Sí,2020-11-04,Atlántico,,CDI Fundación Daseín,"Les voy a contar una experiencia que viví con un niño con síndrome de Downs el niño llegó al cdi que no le gustaba tener zapatos puestos y desde que llegaba hasta que se iba, comía directamente con la boca, se sacaba la comida y se echaba a los compañeros, los lápices y las crayadolas rayaba todas paredes, no fue fácil el proceso, con mucho paciencia y amor fui cambiando todos esos malos hábitos con ayuda de la mamá, porque se formó a la madre para trabajara en casa, leí mucho sobre el comportamiento de los niños con downs y trabaje con la música folclórica de mi Barranquilla y los resultados fueron muy gratificantes.",Con amor todo es posible,Motivación,Única vez,El acompañamiento a las transiciones de las niñas y los niños.,0,0,0,0,0,0,0,1,0,0,0,Niños/niñas,,Fui muy honesto y conté lo que me pasó,"Habilidades artísticas: bailar, cantar, actuar/representar, dibujar/pintar, tocar instrumentos, modelar, jugar. Habilidades comunicativas: contar historias, argumentar, conversar, exponer ideas, escribir textos, leer y comprender. Habilidades socioemocionales:  meditar, acompañar y guiar, sentido del humor, incentivar y motivar, compartir y ser solidario, auto-regulación.",1,1,1,0,0,0,Trabajo Colaborativo.,1,0,0,0,0,0,0,0,Potenciar el desarrollo de los niños y las niñas.,134967424,d1b4101c-5609-465c-af8f-3d34b5a4b52b,2020-11-04T14:46:09,,46
2020-11-04T09:34:34.420-05:00,2020-11-04T09:47:55.485-05:00,2020-11-03,Sí,2020-11-04,Atlántico,,CDI luz 2 ADR,"Como psicosocial del CDI mi labor va encaminada a abordar con las familias las temáticas necesarias para el desarrollo de los niños, el año pasado vivímos una experiencia muy significativa, donde en compañía de las familias nos dirigimos a las instituciones educativas dónde los niños iban a transitar, donde iban a estar este año, allí conocieron las instalaciones del colegio, los maestros que durante éste año estarían en transición fueron los encargados de recibirnos y presenciamos una clase con los niños que ese momento estaban en el grado de transición, fue una experiencia muy enrriquecedora, los niños y sus familias comprendieron el significado de transitar..fue un día excelente",# laalegriadetransitar...,Alegría,Única vez,La vinculación de las familias a las propuestas del Centro de Desarrollo Infantil. El acompañamiento a las transiciones de las niñas y los niños.,0,0,1,0,0,0,0,1,0,0,0,Niños/niñas,,Fui muy honesto y conté lo que me pasó,"Habilidades socioemocionales:  meditar, acompañar y guiar, sentido del humor, incentivar y motivar, compartir y ser solidario, auto-regulación.",0,0,1,0,0,0,Trabajo Colaborativo. Resolución de problemas. Manejo de la Información y Comunicación. Creatividad e Innovación.,1,0,0,1,0,1,1,0,Acompañar a las familias para que apoyen el desarrollo de sus hijos.,134967882,88849cb8-a624-4cde-95e6-fd32abdf97e1,2020-11-04T14:48:07,,47
2020-11-04T09:42:11.302-05:00,2020-11-04T09:49:48.510-05:00,2020-11-03,Sí,2020-11-04,Atlántico,,CDI LUZ DOS ADR,Mi  experiencia en esta trayectoria me  ha sidi significativa con l9s niños. Pués hace tres años tuve un niño con una limitación especial autista leve moderado . El cual hacia parte de otro ambiente . No siendo el mio. Cada vez que entraba no se sentía a gusto todo lo que encontraba a su alrededor lo tiraba al suelo . Pues viendo la situación del niño me lo traje a mi ambiente ví la nec3sidad del niño. Otro cambio tuvo aceptado con l9s demás niños yo no lo obligaba a entrar a las experiencias lo dejaba por si solo q el entrara. D3sdeentonces el niño tuvo un cambio positivo. Alegría con los demas niños.....,LA HISTORIA DE ALESS,Motivación,Única vez,El acompañamiento a las transiciones de las niñas y los niños.,0,0,0,0,0,0,0,1,0,0,0,Niños/niñas,,Fui muy honesto y conté lo que me pasó,"Habilidades socioemocionales:  meditar, acompañar y guiar, sentido del humor, incentivar y motivar, compartir y ser solidario, auto-regulación.",0,0,1,0,0,0,Creatividad e Innovación.,0,0,0,0,0,0,1,0,Potenciar el desarrollo de los niños y las niñas.,134968303,c162b340-3efd-41a5-941d-f5477cb463ce,2020-11-04T14:49:50,,48
2020-11-05T14:09:32.986-05:00,2020-11-05T15:58:37.143-05:00,2020-11-04,Sí,2020-11-05,Atlántico,,Fundangelitos,La colaboración con los padres de familia en las experiencias significativas ha sido muy positiva.,#experiencias,Alegría,Todo el tiempo,La vinculación de las familias a las propuestas del Centro de Desarrollo Infantil. El acompañamiento a las transiciones de las niñas y los niños.,0,0,1,0,0,0,0,1,0,0,0,Niños/niñas,,Fui muy honesto y conté lo que me pasó,"Habilidades artísticas: bailar, cantar, actuar/representar, dibujar/pintar, tocar instrumentos, modelar, jugar. Habilidades comunicativas: contar historias, argumentar, conversar, exponer ideas, escribir textos, leer y comprender.",1,1,0,0,0,0,Trabajo Colaborativo. Creatividad e Innovación.,1,0,0,0,0,0,1,0,Acompañar a las familias para que apoyen el desarrollo de sus hijos.,135314501,a5513666-b3da-4a8e-8f3b-0dea98d57534,2020-11-05T20:58:49,,50
2020-11-05T15:55:17.596-05:00,2020-11-05T16:02:02.360-05:00,2020-11-04,Sí,2020-11-05,Atlántico,,CDI Carrizal Institucional,En el centro de desarrollo infantil una de las experiencias más significativas que he vivido fue conocer cada una de las familias vinculadas y el esmero que han colocado en las actividades enviadas semanalmente para contribuir al desarrollo del niño,#LOSPADRESTAMBIENPUEDEN,Motivación,Todo el tiempo,Otro,0,0,0,0,0,0,0,0,0,0,1,Familias y otras personas significativas,,Fui muy honesto y conté lo que me pasó,"Habilidades socioemocionales:  meditar, acompañar y guiar, sentido del humor, incentivar y motivar, compartir y ser solidario, auto-regulación.",0,0,1,0,0,0,Creatividad e Innovación.,0,0,0,0,0,0,1,0,Acompañar a las familias para que apoyen el desarrollo de sus hijos.,135314770,4271269a-33cd-4399-a964-10e20759270f,2020-11-05T21:02:15,,51
2020-11-05T15:54:55.470-05:00,2020-11-05T16:00:43.022-05:00,2020-11-04,Sí,2020-11-05,Atlántico,,CDI San Luis Institucional,"Los niños a pesar de la pandemia se han motivado en casa a trabajar las experiencias pedagogicas por medio del juego,  la exploracion y la literatura",#LosNiñosEnPandemia,Motivación,Todo el tiempo,La vinculación de las familias a las propuestas del Centro de Desarrollo Infantil.,0,0,1,0,0,0,0,0,0,0,0,Niños/niñas,,Me dio curiosidad e inventé la historia,"Habilidades comunicativas: contar historias, argumentar, conversar, exponer ideas, escribir textos, leer y comprender.",0,1,0,0,0,0,Trabajo Colaborativo.,1,0,0,0,0,0,0,0,Acompañar a las familias para que apoyen el desarrollo de sus hijos.,135314666,77161f8d-1cff-4fd3-9e7d-4386d1aed062,2020-11-05T21:00:53,,52
2020-11-05T10:39:39.411-05:00,2020-11-05T10:45:17.272-05:00,2020-11-04,Sí,2020-11-05,Atlántico,,Carrizal institucional,Las asambleas grupales con música infantil o alabanzas suaves son un espacio propicio para que los niños o niñas se calmen e interactúen de manera más activa con los demás compañeritos,#asambleasgrupales,Motivación,De vez en cuando,La apropiación y uso de herramientas tecnológicas. La disposición intencionada de los espacios y ambientes. El trabajo colaborativo entre las y los Agentes Educativos.,1,0,0,0,0,1,0,0,0,1,0,Niños/niñas,,Fui muy honesto y conté lo que me pasó,"Habilidades artísticas: bailar, cantar, actuar/representar, dibujar/pintar, tocar instrumentos, modelar, jugar. Habilidades socioemocionales:  meditar, acompañar y guiar, sentido del humor, incentivar y motivar, compartir y ser solidario, auto-regulación.",1,0,1,0,0,0,Trabajo Colaborativo. Manejo de herramientas tecnológicas. Creatividad e Innovación.,1,0,0,0,1,0,1,0,Potenciar el desarrollo de los niños y las niñas.,135254581,08891b57-2be4-44dc-9d07-0dfd9d971e63,2020-11-05T15:45:28,,53
2020-11-05T10:46:16.800-05:00,2020-11-05T10:55:05.875-05:00,2020-11-04,Sí,2020-11-05,Atlántico,,Santuario 2,En mi grupo cuento con unniño con paralisis cerebral espatica lo cual le dificulta en algunos caso la movilidad he realizado varias actividades para  seguir desarrollando el equilibrio y cordinacion en  una oportunidad con ayuda de la mamita el niño intento caminar por una linea recta al principio necesito mucho apoyo luego se animo y lo realizaba solo,#discapacidad.cordinacion motriz,Motivación,De vez en cuando,La vinculación de las familias a las propuestas del Centro de Desarrollo Infantil. El trabajo colaborativo entre las y los Agentes Educativos.,0,0,1,0,0,0,0,0,0,1,0,Niños/niñas,,Fui muy honesto y conté lo que me pasó,"Habilidades comunicativas: contar historias, argumentar, conversar, exponer ideas, escribir textos, leer y comprender.",0,1,0,0,0,0,Manejo de herramientas tecnológicas.,0,0,0,0,1,0,0,0,Acompañar a las familias para que apoyen el desarrollo de sus hijos.,135257356,a9b809ea-e307-4c6c-9fcd-0dcf7755fb36,2020-11-05T15:55:22,,54
2020-11-05T10:52:23.669-05:00,2020-11-05T10:56:47.940-05:00,2020-11-04,Sí,2020-11-05,Atlántico,,CDI CARRIZAL,"Tuve una experiencia en mis prácticas con los niños, y me pude dar cuenta, cuanta imaginación pueden tener cada uno de ellos, y más una en especial una niña que cuando llegue se apago mucho a mi, siempre tenía que estar cerca de mi, tenía yo que darle la comida, dormir la jugar con ella, ya que si yo no estaba colocaba a llorar, y dije es tan bonito como pueden apegarse los niños fácilmente a uno, y fue una de las experiencias más bonitas que tuve",#MiExperiencia,Motivación,Todo el tiempo,El acompañamiento a las transiciones de las niñas y los niños. La documentación de las experiencias realizadas en el Centro de Desarrollo Infantil.,0,0,0,0,0,0,0,1,1,0,0,Niños/niñas,,Fui muy honesto y conté lo que me pasó,"Habilidades artísticas: bailar, cantar, actuar/representar, dibujar/pintar, tocar instrumentos, modelar, jugar.",1,0,0,0,0,0,Trabajo Colaborativo.,1,0,0,0,0,0,0,0,Potenciar el desarrollo de los niños y las niñas.,135257933,7346be80-c76c-40e0-94b6-bee3224482a6,2020-11-05T15:57:00,,55
2020-11-05T10:37:34.228-05:00,2020-11-05T11:11:32.090-05:00,2020-11-04,Sí,2020-11-05,Atlántico,,Fundacion fusion celestial,"Al desarrollar la actividad el  la busqueda del gran tesoso donde la niña Chriss Mariana chaguala explorando el medio con gran emocion fue dejando su huella de color amarillo en compañia de su madre interactuando con su lupa recorria el corredor, las habitaciones de manera divertida encontro debajo de unos libros el gran tesorobusqueda del gran tesoro dencia niñas y niños se animaron a",# hallemos el gran tesoro,Alegría,Todo el tiempo,La disposición intencionada de los espacios y ambientes.,0,0,0,0,0,1,0,0,0,0,0,Niños/niñas,,Fui muy honesto y conté lo que me pasó,"Habilidades comunicativas: contar historias, argumentar, conversar, exponer ideas, escribir textos, leer y comprender.",0,1,0,0,0,0,Creatividad e Innovación.,0,0,0,0,0,0,1,0,Acompañar a las familias para que apoyen el desarrollo de sus hijos.,135261862,2138cc55-38b6-45a2-b71a-6b4ed4e25f16,2020-11-05T16:11:53,,56
2020-11-05T10:59:30.916-05:00,2020-11-05T11:14:23.284-05:00,2020-11-04,Sí,2020-11-05,Atlántico,,CDI Carrizal,Mi historia es positiva cuando entre a trabajar en el CDI Carrizal me encontré un niño autista que no hablaba todo lo manifestaba por gestos cuando lo ví no sabía que tenía está discapacidad al analizarlo le pregunté a la maestra y ella me comentó la discapacidad y Ali empeze a analizar cómo podía interactuar con el nació un vínculo afectivo entre los dos el todos los días cuando llegaba me tomaba de la mano y me dirigía a las telier dónde se colocan los materiales de trabajo para que le diera un pedazo de lana del color que le llamaba la atención y si un niño se lo quitaba me buscaba para que se lo quitara cuando quería agua me apretaba el dedo todo lo hacía de esta manera y esto fue un reto porque cada día lo iba conociendo más por medio de sus gestos en compañía de la psico y la maestra y yo como auxiliar le empezamos a enseñar palabras y fue captandolas y salió del CDI diciendo algunas y lo que más me gustaba que sus compañeros lo cuidaban y estaba pendiente de él no lo discriminaban fue una gran experiencia,Mi héroe autista,Motivación,De vez en cuando,La vinculación de las familias a las propuestas del Centro de Desarrollo Infantil. La calidad de las interacciones entre los actores. El trabajo colaborativo entre las y los Agentes Educativos.,0,0,1,0,0,0,1,0,0,1,0,Niños/niñas,,Fui muy honesto y conté lo que me pasó,"Habilidades socioemocionales:  meditar, acompañar y guiar, sentido del humor, incentivar y motivar, compartir y ser solidario, auto-regulación.",0,0,1,0,0,0,Trabajo Colaborativo. Manejo de la Información y Comunicación. Creatividad e Innovación.,1,0,0,0,0,1,1,0,Acompañar a las familias para que apoyen el desarrollo de sus hijos.,135262811,31ca1924-63f4-461c-acde-65938ab13d16,2020-11-05T16:14:47,,57
2020-11-04T09:07:41.690-05:00,2020-11-04T09:41:25.839-05:00,2020-11-03,Sí,2020-11-04,Atlántico,,CDI LUZ DOS ADR,Mi experiencia en esta trayectoria con  los niños y niñas me ha   marcado con una situación real. Donde tuve un niño con una limitación especial es autista leve moderado. Pués no era mio si no de otra maestra no aceptó el grupo en el de la compañera era un huracan cada vez que llegaba al ambiente todo lo tiraba al suelo; viendo esta actitud tomé la iniciativa en llevarlo a mi ambiente donde se adaptó a mi grupo me lo gané con sus gustos . Lo dejaba que fuera el mismo que se involucrara a la asamblea y experiencias. No lo obligaba era lo que pasaba en el otro ambiente. Desde entonces el cambio del niño fué diferente y era el consentido por los demas niños y niñas.,EL AMOR DE  ALESSANDRO,Motivación,Única vez,El acompañamiento a las transiciones de las niñas y los niños.,0,0,0,0,0,0,0,1,0,0,0,Niños/niñas,,Fui muy honesto y conté lo que me pasó,"Habilidades socioemocionales:  meditar, acompañar y guiar, sentido del humor, incentivar y motivar, compartir y ser solidario, auto-regulación.",0,0,1,0,0,0,Creatividad e Innovación.,0,0,0,0,0,0,1,0,Potenciar el desarrollo de los niños y las niñas.,135270496,e7f99815-8366-4dbf-ae71-b79e1412d00f,2020-11-05T16:39:19,,58
2020-11-05T10:54:00.043-05:00,2020-11-05T11:45:08.516-05:00,2020-11-04,Sí,2020-11-04,Atlántico,,LUZ DOS,ALGO QUE ME IMPACTO FUE LA DE UN NIÑO  EN EL AÑO 2018 EL ERA UN NIÑO QUE NO PRONUNCIABA PALABRAS TODO ERA CON SEÑAS YO DIJE NO HAY QUE HABLAR ESO CON LA PSICOLOGA EMPESAMOS A MANEJAR EL PROBLEMA DEL NIÑO CON LOS PADRES Y LA RESPUESTA QUE NOS DABA LA MAMITA ERA QUE SU PRIMERA HIJA ES ESPECIAL NO HABLA ES MUY ACTIVA EN FIN EMPECE EL PROCESO YA EN EL 2019 NO SIGUIO CON MIGO PASO A OTRO AMBIENTE BUENO YA HABIAN PASADO DOS MESES Y ESTABA EN EL COMEDOR CON UNAS DE LAS COMPAÑERA AUXILIAR PEDAGOGICA LOS NIÑOS Y NIÑAS DEL ANTERIOR AÑO ME LLORABAN NO QUERIAN LA MAESTRA NUEVA ESO ES NORMAL EN ESA EDAD YA CON LOS DIAS SE ACOSTUMBRARON A LA MAESTRA NUEVA BUENO PARA FINALIZAR LLEGO UN MOMENTO EN QUE EL NIÑO ME DICE SEÑO JUGO YO BRINQUE Y BRINQUE Y MI COMPAÑERA AUXILIAR ELLA VIVIA CON MIGO MI PREOCUPACION Y ELLA LLEGO A MI Y ME ABRAZO Y ME DECIA Y YO LE DECIA SI HABLA SI HABLA ESO FUE PARA MI UNA GRAN EXPERIENCIA EN MI CARRERA EN MI ROL COMO MAESTRA Y YO SE QUE EN ESE NIÑO YO DEJE UNA HUELLA POR QUE FUERON MUCHAS ACTIVIDADES PARA QUE APRENDIERA A PRONUNCIAR LAS PALABRAS LE DOY LA GRACIAS A DIOS POR DEJAR QUE MI SUEÑO SE CUMPLIERA Y NO SOLO A ESE NIÑO QUIERO AYUDAR SI SE DAN LAS OPORTUNIDADES A TODOS LOS QUE NECESITEN DE MI GRACIAS.                                                                                                                                A UN NIÑO CON POCA FLUIDEZ VERBAL PARA SU EDAD NO HABLAVA,""" SEMBRANDO HUELLAS""",Motivación,Única vez,El desempeño de los docentes y sus prácticas. La calidad de las interacciones entre los actores. El trabajo colaborativo entre las y los Agentes Educativos.,0,0,0,0,1,0,1,0,0,1,0,Niños/niñas,,Reflexioné y aprendí algo nuevo,"Habilidades comunicativas: contar historias, argumentar, conversar, exponer ideas, escribir textos, leer y comprender.",0,1,0,0,0,0,Trabajo Colaborativo. Pensamiento Crítico. Creatividad e Innovación.,1,0,1,0,0,0,1,0,Potenciar el desarrollo de los niños y las niñas.,135272020,ea5586a3-50a6-4ba1-8455-d204af5f01ad,2020-11-05T16:45:25,,59
2020-11-05T11:21:11.007-05:00,2020-11-05T12:40:23.560-05:00,2020-11-04,Sí,2020-11-05,Atlántico,,Amira de la rosa,Ahora con esta pandemia estamos trabajando virtual llamando   al padre de familia comunicarle las acividades q van a trabajar  con sus niños hijos y la maestra les  manda los trabajos los enviamos a los padre por medio de wasspp y tambien por via telefonica y despue los padres manda las evidenciascon sus niños las tareas pero aveces algunos padres no manda evidencia,El mundo sin covid 19,Motivación,Única vez,El desempeño de los docentes y sus prácticas.,0,0,0,0,1,0,0,0,0,0,0,Familias y otras personas significativas,Exelente,Fui muy honesto y conté lo que me pasó,"Habilidades socioemocionales:  meditar, acompañar y guiar, sentido del humor, incentivar y motivar, compartir y ser solidario, auto-regulación.",0,0,1,0,0,0,Trabajo Colaborativo.,1,0,0,0,0,0,0,0,Acompañar a las familias para que apoyen el desarrollo de sus hijos.,135284981,8db685ed-1ef4-442c-8101-03dea6320755,2020-11-05T17:40:34,,60
